{
  "schema_version": 1,
  "house": {
    "name": "medieval_house",
    "width": 9.0,
    "depth": 7.0,
    "floors": 2,
    "style": "medieval",
    "stone_walls": false,
    "terrain_margin": 8.0,
    "tree_count": 10,
    "seed": 11
  },
  "floors": [
    {
      "level": 0,
      "height": 2.6,
      "wall_thickness": 0.35,
      "rooms": [
        {
          "name": "hall",
          "x": 0.0,
          "y": 0.0,
          "width": 5.0,
          "depth": 7.0
        },
        {
          "name": "kitchen",
          "x": 5.0,
          "y": 0.0,
          "width": 4.0,
          "depth": 7.0
        }
      ],
      "doors": [
        {
          "type": "door",
          "wall": "L0_hall:south",
          "position": 0.5,
          "width": 1.0,
          "height": 2.0,
          "sill": 0.0
        }
      ],
      "windows": [
        {
          "type": "window",
          "wall": "L0_hall:west",
          "position": 0.3,
          "width": 1.0,
          "height": 1.0,
          "sill": 1.0
        },
        {
          "type": "window",
          "wall": "L0_hall:west",
          "position": 0.7,
          "width": 1.0,
          "height": 1.0,
          "sill": 1.0
        },
        {
          "type": "window",
          "wall": "L0_kitchen:east",
          "position": 0.5,
          "width": 0.9,
          "height": 1.0,
          "sill": 1.0
        }
      ]
    },
    {
      "level": 1,
      "height": 2.4,
      "wall_thickness": 0.35,
      "rooms": [
        {
          "name": "solar",
          "x": 0.0,
          "y": 0.0,
          "width": 9.0,
          "depth": 7.0
        }
      ],
      "doors": [],
      "windows": [
        {
          "type": "window",
          "wall": "L1_solar:south",
          "position": 0.3,
          "width": 0.8,
          "height": 1.0,
          "sill": 0.9
        },
        {
          "type": "window",
          "wall": "L1_solar:south",
          "position": 0.7,
          "width": 0.8,
          "height": 1.0,
          "sill": 0.9
        },
        {
          "type": "window",
          "wall": "L1_solar:north",
          "position": 0.5,
          "width": 0.8,
          "height": 1.0,
          "sill": 0.9
        }
      ]
    }
  ],
  "roof": {
    "type": "gable",
    "pitch": 52.0,
    "overhang": 0.7,
    "thickness": 0.2,
    "ridge_axis": "auto",
    "material": "ROOF"
  }
}
